{
  "$schema": "../schemas/agent-registry.v1.json",
  "version": "1.0.0",
  "description": "TDS AI 조직 에이전트 레지스트리 — 단일 원천(SSOT). CODEOWNERS, skills/, 오케스트레이션이 전부 이 파일에서 파생된다. 수정은 A01(Architecture AI) ADR 승인 후에만 가능.",
  "note": "50개 (L0:8[A00 포함] + L1:10 + L2:23 + L3:9). 39(ADR-0001) → 46(ADR-0006) → 47(A84, ADR-0007 참조) → 50(ADR-0010: A77 Test Coverage Guard · A85 E2E Test Engineer · A86 Security Reviewer). 기대 수의 정본은 orchestration/schemas/agent-registry.v1.json 의 minItems/maxItems 이며 validate-registry.ts 가 거기서 읽는다.",
  "agents": [
    {
      "id": "A00",
      "slug": "ceo-orchestrator",
      "title": "CEO AI (Orchestrator)",
      "layer": 0,
      "division": "governance",
      "type": "orchestrator",
      "owns": ["orchestration/tasks/**", "orchestration/state/**"],
      "reads": ["**/*"],
      "gate": "G0",
      "approves": ["G0"],
      "reviewer": null,
      "blocks": [],
      "outputs": ["Task Graph", "실행 계획", "에스컬레이션 판정"],
      "escalatesTo": "human",
      "notes": "모든 게이트 override 권한 보유 — 단 ADR 기록 + 기술부채 티켓 발행 필수"
    },
    {
      "id": "A01",
      "slug": "architecture",
      "title": "Architecture AI",
      "layer": 0,
      "division": "governance",
      "type": "governor",
      "owns": [
        "README.md",
        "docs/adr/**",
        "docs/architecture/**",
        "tsconfig*.json",
        "*.config.*",
        "orchestration/registry/**",
        "orchestration/schemas/**"
      ],
      "reads": ["**/*"],
      "gate": null,
      "approves": [],
      "reviewer": null,
      "blocks": [],
      "outputs": ["ADR", "Folder Structure", "Dependency Rules", "Lint 규칙"],
      "escalatesTo": "A00",
      "notes": "설계 거부권 보유. 구현 코드 작성 금지. 레지스트리/스키마 변경의 유일한 승인자"
    },
    {
      "id": "A02",
      "slug": "boundary-enforcer",
      "title": "Boundary Enforcer AI",
      "layer": 0,
      "division": "governance",
      "type": "verifier",
      "owns": [".github/CODEOWNERS", "tools/boundary/**", "reports/boundary/**"],
      "reads": ["orchestration/registry/agents.json", "**/*"],
      "gate": null,
      "approves": [],
      "reviewer": null,
      "blocks": ["PR"],
      "outputs": ["소유권 위반 리포트", "CODEOWNERS(레지스트리에서 자동 생성)"],
      "escalatesTo": "A01",
      "notes": "CODEOWNERS는 손으로 쓰지 않는다 — tools/boundary/generate-codeowners.ts가 agents.json에서 생성"
    },
    {
      "id": "A03",
      "slug": "release-manager",
      "title": "Release Manager AI",
      "layer": 0,
      "division": "governance",
      "type": "governor",
      "owns": ["CHANGELOG.md", "docs/migration/**", "package.json#version"],
      "reads": ["contracts/**", "docs/**", "**/review/**"],
      "gate": "G8",
      "approves": ["G8"],
      "reviewer": null,
      "blocks": ["release"],
      "outputs": [
        "SemVer 판정",
        "Changelog",
        "Deprecation 정책",
        "Release Note",
        "Migration Guide"
      ],
      "escalatesTo": "A00",
      "notes": "하위호환 ↔ 클린 API 충돌의 판정자. Deprecation 경로 없는 Breaking 금지"
    },
    {
      "id": "A86",
      "slug": "security-reviewer",
      "title": "Security Reviewer",
      "layer": 0,
      "division": "governance",
      "type": "reviewer",
      "owns": ["docs/security/**", "reports/security/**"],
      "reads": ["**/*"],
      "gate": null,
      "approves": [],
      "reviewer": null,
      "blocks": ["G6", "G9"],
      "blockCondition": "보안 결함 — 인증/인가 우회, 열거 오라클, CSRF, 멱등성 부재, 감사 로그 누락, 비밀 노출, 권한을 프론트에서만 판정",
      "outputs": [
        "보안 검수 리포트 (reports/security/) — 체크리스트 10축 항목별 O/X",
        "보안 정책 결정문 (docs/security/)"
      ],
      "escalatesTo": "A00",
      "notes": "게이트 approver 가 아니라 blocker 다 — G6 approver 는 A42, G9 approver 는 A64로 유지된다(게이트 하나에 승인자 둘은 상태머신을 깨뜨린다). A86 은 그들의 승인 **전에** blocker 를 걸 수 있다. 코드를 고치지 않는다 — 리포트만 낸다. 보안 판정 8건이 A63(문서 작가)에게서 나와 A01에게 떠넘겨진 것이 신설 근거 (ADR-0010). reads: **/* 인 4명 중 하나 — 비밀 노출은 어디에나 있을 수 있다."
    },
    {
      "id": "A10",
      "slug": "ux-planner",
      "title": "UX Planner",
      "layer": 1,
      "division": "planning",
      "type": "producer",
      "owns": ["docs/plan/ux/**"],
      "reads": ["docs/plan/**", "docs/tds/**", "reports/reuse/**"],
      "gate": "G1",
      "approves": [],
      "reviewer": "A12",
      "blocks": [],
      "outputs": ["IA", "User Flow", "Sitemap", "Screen Flow", "Business Flow"],
      "escalatesTo": "A00",
      "notes": null
    },
    {
      "id": "A11",
      "slug": "ui-planner",
      "title": "UI Planner",
      "layer": 1,
      "division": "planning",
      "type": "producer",
      "owns": ["docs/plan/ui/**"],
      "reads": ["docs/plan/ux/**", "docs/tds/**", "reports/reuse/**", "contracts/**"],
      "gate": "G1",
      "approves": [],
      "reviewer": "A12",
      "blocks": [],
      "outputs": ["Screen Spec (SCR-NNN)", "컴포넌트 필요/재사용 판정 요청"],
      "escalatesTo": "A00",
      "notes": "신규 컴포넌트 표기 전 반드시 A75(Reuse Guard) 조회 결과 첨부"
    },
    {
      "id": "A12",
      "slug": "planning-reviewer",
      "title": "Planning Reviewer",
      "layer": 1,
      "division": "planning",
      "type": "reviewer",
      "owns": ["docs/plan/review/**"],
      "reads": ["docs/plan/**", "reports/reuse/**"],
      "gate": "G1",
      "approves": ["G1"],
      "reviewer": null,
      "blocks": ["G1"],
      "outputs": ["요구사항 검수 리포트 (RR-G1-*)"],
      "escalatesTo": "A00",
      "notes": "체크리스트: docs/_templates/checklists/G1.md"
    },
    {
      "id": "A13",
      "slug": "ux-designer",
      "title": "UX Designer",
      "layer": 1,
      "division": "design",
      "type": "producer",
      "owns": ["docs/design/ux/**"],
      "reads": ["docs/plan/**", "tokens/**", "docs/tds/**"],
      "gate": "G2",
      "approves": [],
      "reviewer": "A17",
      "blocks": [],
      "outputs": [
        "Interaction Spec",
        "Keyboard Map",
        "Focus Order",
        "Motion Spec",
        "Responsive 규칙"
      ],
      "escalatesTo": "A00",
      "notes": null
    },
    {
      "id": "A14",
      "slug": "ui-designer",
      "title": "UI Designer",
      "layer": 1,
      "division": "design",
      "type": "producer",
      "owns": ["docs/design/ui/**"],
      "reads": ["docs/plan/**", "tokens/**", "docs/tds/**"],
      "gate": "G2",
      "approves": [],
      "reviewer": "A17",
      "blocks": [],
      "outputs": ["Visual Spec (Layout/Grid/Type/Color/Shadow/Radius/Spacing)"],
      "escalatesTo": "A00",
      "notes": "모든 값은 토큰 참조로 기술 — 하드코딩 hex/px 0건"
    },
    {
      "id": "A15",
      "slug": "icon-designer",
      "title": "Icon Designer",
      "layer": 1,
      "division": "design",
      "type": "producer",
      "owns": ["assets/icons/**"],
      "reads": ["docs/design/**", "tokens/**"],
      "gate": "G2",
      "approves": [],
      "reviewer": "A17",
      "blocks": [],
      "outputs": ["SVG 아이콘 (12/16/20/24 × Filled/Outlined/Rounded/Sharp)"],
      "escalatesTo": "A00",
      "notes": null
    },
    {
      "id": "A16",
      "slug": "illustration-designer",
      "title": "Illustration Designer",
      "layer": 1,
      "division": "design",
      "type": "producer",
      "owns": ["assets/illustrations/**"],
      "reads": ["docs/design/**", "tokens/**"],
      "gate": "G2",
      "approves": [],
      "reviewer": "A17",
      "blocks": [],
      "outputs": ["Empty / Error / Success / Loading / No-Data 일러스트"],
      "escalatesTo": "A00",
      "notes": null
    },
    {
      "id": "A17",
      "slug": "design-reviewer",
      "title": "Design Reviewer",
      "layer": 1,
      "division": "design",
      "type": "reviewer",
      "owns": ["docs/design/review/**"],
      "reads": ["docs/design/**", "assets/**", "tokens/**"],
      "gate": "G2",
      "approves": ["G2"],
      "reviewer": null,
      "blocks": ["G2"],
      "outputs": ["디자인 검수 리포트 (RR-G2-*)"],
      "escalatesTo": "A00",
      "notes": "접근성 ↔ 비주얼 충돌 시 접근성 우선으로 반려. 체크리스트: docs/_templates/checklists/G2.md"
    },
    {
      "id": "A18",
      "slug": "contract-engineer",
      "title": "Component Contract Engineer",
      "layer": 1,
      "division": "contract",
      "type": "producer",
      "owns": ["contracts/*.contract.json", "contracts/schemas/**"],
      "reads": ["docs/plan/**", "docs/design/**", "tokens/**", "docs/tds/**"],
      "gate": "G3",
      "approves": [],
      "reviewer": "A19",
      "blocks": [],
      "outputs": ["*.contract.json (Props · Variants · Slots · Events · States · A11y)"],
      "escalatesTo": "A01",
      "notes": "★핵심. 계약은 G3 통과 시 Frozen — 변경은 G3 재진입 + SemVer 판정 필수"
    },
    {
      "id": "A19",
      "slug": "contract-reviewer",
      "title": "Contract Reviewer",
      "layer": 1,
      "division": "contract",
      "type": "reviewer",
      "owns": ["contracts/review/**"],
      "reads": ["contracts/**", "docs/design/**", "docs/plan/**"],
      "gate": "G3",
      "approves": ["G3"],
      "reviewer": null,
      "blocks": ["G3"],
      "outputs": ["계약 검수 리포트 (RR-G3-*)"],
      "escalatesTo": "A01",
      "notes": "가장 중요한 게이트. G3 통과 전 Layer 2 착수 금지. 체크리스트: docs/_templates/checklists/G3.md"
    },
    {
      "id": "A20",
      "slug": "token-engineer",
      "title": "Design Token Engineer",
      "layer": 2,
      "division": "token",
      "type": "producer",
      "owns": ["tokens/tokens.json", "tokens/themes/**"],
      "reads": ["docs/design/**", "contracts/**"],
      "gate": "G4",
      "approves": [],
      "reviewer": "A21",
      "blocks": [],
      "outputs": ["tokens.json (W3C DTCG) — Source of Truth"],
      "escalatesTo": "A01",
      "notes": "3계층: primitive → semantic → component. 컴포넌트가 primitive 직접 참조 금지"
    },
    {
      "id": "A21",
      "slug": "token-reviewer",
      "title": "Token Reviewer",
      "layer": 2,
      "division": "token",
      "type": "reviewer",
      "owns": ["tokens/review/**"],
      "reads": ["tokens/**", "docs/design/**"],
      "gate": "G4",
      "approves": ["G4"],
      "reviewer": null,
      "blocks": ["G4"],
      "outputs": ["토큰 검수 리포트 (RR-G4-*)"],